{"apiVersion":"patroni.pgsty.com/v1alpha1","kind":"ClusterList","metadata":{"requestId":"cli-operation-1","observedAt":"2026-07-13T12:34:56Z","warnings":[]},"data":{"clusters":[{"target":{"context":"lab","namespace":"/service","scope":"alpha"},"discoveryState":"DISCOVERED","managementState":"EXPLICIT","reachabilityState":"UNKNOWN","healthState":"UNKNOWN","revision":8,"initialize":"12345","leader":"node-a","paused":false,"members":[{"target":{"context":"lab","namespace":"/service","scope":"alpha","member":"node-a"},"name":"node-a","apiUrl":"https://node-a:8008/patroni","host":"node-a","port":5433,"role":"leader","state":"running","timeline":2,"patroniVersion":"4.1.0"},{"target":{"context":"lab","namespace":"/service","scope":"alpha","member":"node-b"},"name":"node-b","apiUrl":"https://node-b:8008/patroni","host":"node-b","port":5432,"role":"sync_standby","state":"streaming","timeline":2,"patroniVersion":"4.1.0"}]}]}}
