{"apiVersion":"patroni.pgsty.com/v1alpha1","kind":"ClusterList","metadata":{"requestId":"machine-schema-example","observedAt":"2026-07-13T12:34:56Z","warnings":[]},"data":{"clusters":[{"target":{"context":"default","namespace":"/service","scope":"alpha","group":1,"member":"node-a"},"discoveryState":"DISCOVERED","managementState":"EXPLICIT","reachabilityState":"REACHABLE","healthState":"HEALTHY","revision":1,"initialize":"example","leader":"node-a","paused":false,"scheduledSwitchover":{"at":"2026-07-13T12:34:56Z","from":"example","to":"example"},"members":[{"target":{"context":"default","namespace":"/service","scope":"alpha","group":1,"member":"node-a"},"name":"node-a","apiUrl":"https://node-a.example.invalid:8008","host":"node-a.example.invalid","port":1,"role":"leader","state":"example","timeline":1,"receiveLsn":"example","receiveLagBytes":1,"replayLsn":"example","replayLagBytes":1,"pendingRestartReason":{"example":"example"},"scheduledRestart":{"schedule":"2026-07-13T12:34:56Z","postgresVersion":"example"},"tags":{"example":"example"},"patroniVersion":"example"}]}]}}
